{
  "format": "aibt.layout",
  "formatVersion": 1,
  "treeId": "tree.test.layout-deep-chain",
  "direction": "topToBottom",
  "nodes": {
    "leaf": {
      "position": {
        "x": 0,
        "y": 480
      }
    },
    "n1": {
      "position": {
        "x": 0,
        "y": 120
      }
    },
    "n2": {
      "position": {
        "x": 0,
        "y": 240
      }
    },
    "n3": {
      "position": {
        "x": 0,
        "y": 360
      }
    },
    "root": {
      "position": {
        "x": 0,
        "y": 0
      }
    }
  }
}
